{
	"$schema": "https://json-schema.org/draft/2020-12/schema",
	"type": "object",
	"required": [
		"RootDir",
		"Core"
	],
	"properties": {
		"Core": {
			"type": "object",
			"description": "Required object. Core build and runtime configuration.",
			"required": [
				"MainAppEntry"
			],
			"properties": {
				"CSSEntryFiles": {
					"type": "object",
					"description": "Optional object. CSS entry points for critical and non-critical style bundles. Both fields are optional and independent.",
					"properties": {
						"Critical": {
							"type": "string",
							"description": "Optional string. Critical CSS entry file. Relative to RootDir.\n\nExample: \"frontend/src/styles/main.critical.css\"",
							"examples": [
								"frontend/src/styles/main.critical.css"
							]
						},
						"NonCritical": {
							"type": "string",
							"description": "Optional string. Non-critical CSS entry file. Relative to RootDir.\n\nExample: \"frontend/src/styles/main.css\"",
							"examples": [
								"frontend/src/styles/main.css"
							]
						}
					}
				},
				"GlobalWatchExcludePatterns": {
					"type": "array",
					"description": "Optional array. Glob patterns excluded from all watch event processing. Relative to RootDir. Directories are auto-expanded to include all descendants.",
					"items": {
						"type": "string"
					}
				},
				"HealthcheckEndpoint": {
					"type": "string",
					"description": "Optional string. HTTP endpoint path used for app readiness polling after restart.\n\nDefault: \"/\"\n\nExamples: \"/\" or \"/healthz\"",
					"default": "/",
					"examples": [
						"/",
						"/healthz"
					]
				},
				"MainAppEntry": {
					"type": "string",
					"description": "Required string. Go application entry path. If a directory is given, main.go is assumed. Relative to RootDir.\n\nExamples: \"cmd/serve\" or \"cmd/serve/main.go\"",
					"examples": [
						"cmd/serve",
						"cmd/serve/main.go"
					]
				},
				"PreventImplicitGoBuildPatterns": {
					"type": "array",
					"description": "Optional array. Glob patterns for .go files that should not implicitly trigger Go recompilation. Relative to RootDir. Directories are auto-expanded to include all descendants.",
					"items": {
						"type": "string"
					}
				},
				"PublicPathPrefix": {
					"type": "string",
					"description": "Optional string. URL prefix for public static assets. Normalized to have leading and trailing slashes.\n\nDefault: \"/\"\n\nExamples: \"/\" or \"/public/\"",
					"default": "/",
					"examples": [
						"/",
						"/public/"
					]
				},
				"ServerOnlyMode": {
					"type": "boolean",
					"description": "Optional boolean. When true, run in server-only mode. This takes precedence over any static asset or CSS configuration that may also be present."
				},
				"StaticAssetDirs": {
					"type": "object",
					"description": "Optional object. Source directories for static assets. Both fields are optional and independent.",
					"properties": {
						"Private": {
							"type": "string",
							"description": "Optional string. Source directory for private static assets. Relative to RootDir.\n\nExample: \"backend/assets\"",
							"examples": [
								"backend/assets"
							]
						},
						"Public": {
							"type": "string",
							"description": "Optional string. Source directory for public static assets. Relative to RootDir.\n\nExample: \"frontend/assets\"",
							"examples": [
								"frontend/assets"
							]
						}
					}
				}
			}
		},
		"LifecycleHooks": {
			"type": "array",
			"description": "Optional array. Lifecycle hooks that run shell commands at defined points in the build cycle.",
			"items": {
				"type": "object",
				"description": "One lifecycle hook definition.",
				"required": [
					"WatchIncludePatterns",
					"Cmd",
					"StartAt",
					"FinishBy",
					"DownstreamEffect"
				],
				"properties": {
					"Cmd": {
						"type": "string",
						"description": "Required string. Shell command to execute when the hook fires."
					},
					"DevOnly": {
						"type": "boolean",
						"description": "Optional boolean. When true, this hook only runs in dev mode."
					},
					"DownstreamEffect": {
						"type": "string",
						"description": "Required string. What downstream action this hook's completion triggers.",
						"enum": [
							"go_compile",
							"app_restart",
							"frontend_revalidate"
						]
					},
					"FinishBy": {
						"type": "string",
						"description": "Required string. Latest checkpoint by which the hook must have completed.",
						"enum": [
							"1_cycle_start",
							"2_build_start",
							"3_go_compile_start",
							"4_build_end",
							"5_cycle_end"
						]
					},
					"IncludeFrontendRebuildingOverlay": {
						"type": "boolean",
						"description": "Optional boolean. When true, a rebuilding overlay is shown in the browser while this hook runs."
					},
					"ProdOnly": {
						"type": "boolean",
						"description": "Optional boolean. When true, this hook only runs in prod mode."
					},
					"StartAt": {
						"type": "string",
						"description": "Required string. Earliest checkpoint at which the hook may begin execution.",
						"enum": [
							"1_cycle_start",
							"2_build_start",
							"3_go_compile_start",
							"4_build_end",
							"5_cycle_end"
						]
					},
					"WatchExcludePatterns": {
						"type": "array",
						"description": "Optional array. Glob patterns excluded from this hook's watch scope. Relative to RootDir. Directories are auto-expanded.",
						"items": {
							"type": "string"
						}
					},
					"WatchIncludePatterns": {
						"type": "array",
						"description": "Required array. Glob patterns that activate this hook when matched. Relative to RootDir. Directories are auto-expanded.",
						"items": {
							"type": "string"
						}
					}
				}
			}
		},
		"RootDir": {
			"type": "string",
			"description": "Required string. Root directory for resolving all other paths. Relative to the config file directory."
		},
		"Vite": {
			"type": "object",
			"description": "Optional object. Vite dev server configuration. When present, JSPackageManagerBaseCmd is required.",
			"required": [
				"JSPackageManagerBaseCmd"
			],
			"properties": {
				"DefaultPort": {
					"type": "number",
					"description": "Optional number. Preferred Vite dev server port.\n\nDefault: 5173",
					"default": 5173
				},
				"JSPackageManagerBaseCmd": {
					"type": "string",
					"description": "Required string. Base command used to run Vite.\n\nExamples: \"pnpm\", \"npx\", \"yarn\", or \"bunx\"",
					"examples": [
						"pnpm",
						"npx",
						"yarn",
						"bunx"
					]
				},
				"JSPackageManagerCmdDir": {
					"type": "string",
					"description": "Optional string. Directory where the JS package manager command should run. Relative to RootDir."
				},
				"ViteConfigFile": {
					"type": "string",
					"description": "Optional string. Explicit Vite config file path. Relative to RootDir.\n\nExample: \"vite.config.ts\"",
					"examples": [
						"vite.config.ts"
					]
				}
			}
		}
	}
}
