{
	"$schema": ".waveout/schema.json",
	"RootDir": ".",
	"Core": {
		"MainAppEntry": "./cmd/tester",
		"HealthcheckEndpoint": "/",
		"GlobalWatchExcludePatterns": ["internal/pkg", "cmd"],
		"PublicPathPrefix": "/bob/",
		"StaticAssetDirs": {
			"Private": "./internal/tester_proj/backend/assets",
			"Public": "./internal/tester_proj/frontend/assets"
		},
		"CSSEntryFiles": {
			"Critical": "./internal/tester_proj/frontend/styles/main.critical.css",
			"NonCritical": "./internal/tester_proj/frontend/styles/main.css"
		}
	},
	"Vite": {
		"JSPackageManagerBaseCmd": "pnpm"
	},
	"LifecycleHooks": []
}
